Cluster,Name_EN,Name_VN,Segment_Type,Strategy_Type,Strategy_Detail,Offer,Channel,Timing,KPI_Target,Top_Rules,Bundle_From_Rules
0,Mainstream Casual Buyers 00,Khách Mua Sắm Thông Thường 00,Mainstream,Mass Cross-sell & Bundle Promotion,"Nhóm khách đại trà (85%) với F=3.6 đơn, M=1,563 GBP. Áp dụng luật kết hợp phổ biến để tăng giỏ hàng trung bình.",Combo 3 sản phẩm giảm 20% | Bundle theo luật kết hợp | Freeship đơn > 50 GBP | Flash sale cuối tuần,"Email blast, Website homepage banner, Facebook Ads, Google Display",Thứ 5-CN hàng tuần | Dịp lễ | Black Friday | Tết,"Tăng AOV +15%, tăng conversion rate +5%","rule_39, rule_58, rule_61, rule_54, rule_52","HERB MARKER MINT... => HERB MARKER CHIVES ... | REGENCY TEA PLATE GREEN ,... => REGENCY TEA PLATE PINK... | REGENCY TEA PLATE ROSES ,... => REGENCY TEA PLATE GREEN ..."
1,Champion Super VIP 01,Siêu VIP Hàng Đầu 01,Champion,VIP Exclusive & Luxury Experience,"TOP SPENDER với M=17,366 GBP (gấp 27x TB). Cần chăm sóc đặc biệt, trải nghiệm luxury.",VIP Card Platinum | Freeship trọn đời | Giảm 25% exclusive | Private sale | Quà tặng VIP đơn > 1000 GBP,"Personal Account Manager, Private Email, SMS VIP Hotline, App VIP Zone",Cá nhân hóa theo lịch sử | Sinh nhật | Kỷ niệm thành viên | Pre-launch exclusive,"Retention rate 95%, tăng M +10%, referral program","rule_9, rule_26, rule_29, rule_3, rule_21","HERB MARKER CHIVES ... => HERB MARKER PARSLEY... | HERB MARKER PARSLEY... => HERB MARKER ROSEMARY... | HERB MARKER PARSLEY, HERB... => HERB MARKER MINT..."
2,Recent Active Buyers 02,Khách Mua Gần Đây 02,Recent,Engagement & Second Purchase Push,Khách mua RẤT GẦN ĐÂY (R=26 ngày). Thời điểm vàng để push đơn thứ 2 và xây dựng loyalty.,Giảm 15% đơn thứ 2 trong 7 ngày | Tích điểm x2 | Free gift đơn > 100 GBP | Review để nhận voucher,"Post-purchase email series, App push notification, Retargeting Ads",Ngày 3 sau mua | Ngày 7 | Ngày 14 | Product recommendation,"Second purchase rate +20%, review rate +30%","rule_38, rule_39, rule_43, rule_56, rule_59","HERB MARKER BASIL, HERB M... => HERB MARKER MINT... | HERB MARKER MINT... => HERB MARKER CHIVES ... | HERB MARKER MINT... => HERB MARKER PARSLEY..."
3,Loyal High-Value 03,Khách Trung Thành Giá Trị Cao 03,Loyal,Loyalty Program & Upsell Premium,"Khách TRUNG THÀNH với F=6.8 đơn, M=2,985 GBP. Tăng giá trị đơn hàng và chuyển đổi lên premium.",Tích điểm x3 | Giảm 20% sản phẩm premium | Early access new arrival | Birthday double points,"Loyalty app, Personalized email, In-app message, SMS reminder",Khi có sản phẩm mới | Trước ngày thường mua | Milestone rewards,"Upsell rate +25%, AOV +20%, referral +15%","rule_56, rule_59, rule_53, rule_39, rule_58",HERB MARKER THYME... => HERB MARKER MINT... | REGENCY SUGAR BOWL GREEN... => REGENCY MILK JUG PINK ... | HERB MARKER BASIL... => HERB MARKER THYME...
4,Loyal High-Value 04,Khách Trung Thành Giá Trị Cao 04,Loyal,Loyalty Program & Upsell Premium,"Khách TRUNG THÀNH với F=8.6 đơn, M=5,258 GBP. Tăng giá trị đơn hàng và chuyển đổi lên premium.",Tích điểm x3 | Giảm 20% sản phẩm premium | Early access new arrival | Birthday double points,"Loyalty app, Personalized email, In-app message, SMS reminder",Khi có sản phẩm mới | Trước ngày thường mua | Milestone rewards,"Upsell rate +25%, AOV +20%, referral +15%","rule_53, rule_55, rule_61, rule_51, rule_54","HERB MARKER BASIL... => HERB MARKER THYME... | HERB MARKER MINT... => HERB MARKER BASIL... | REGENCY TEA PLATE ROSES ,... => REGENCY TEA PLATE GREEN ..."
